ID,Thought,Distortion,Distortion_ID
1216,"This has been an on-going thing for almost my whole life since I was born, my family won’t do anything about it so I’m just in need for advice.",Overgeneralizing,2
1217,"I feared that I’d be stuck with this forever, and thus my symptoms just kept getting worse as a result.",Emotional Reasoning,6
1218,The reason I suspect I may have been sexually abused as a child is because my memory keeps bringing me back to this journal that I had.,Overgeneralizing,2
1219,"I have a terrible dread of my mom’s death. She is in her eighties and I feel I can’t go on without her. I have guilt about not moving to where she lives, to spend precious time with her, but I am law school here (went to law school because I thought it would cure depression) and have a good job also.",Disqualifying the Positive,9
1220,Most of the time I’m getting really angry at the smallest things and my behavior while in this state really worries me.,Catastrophizing,10
1221,I am a jealous person and I have trust issues.,Labeling,3
1222,I never feel fully rested no matter how much I sleep and I generally feel overwhelmed in life.,Overgeneralizing,2
1223,"I did dated guys, we kissed, but when it comes to more I feel shy and scared to say I’m a virgin at my age.",Emotional Reasoning,6
1224,"I finally decided to close a portion of myself because I felt I could not beat it and if I didn’t close off my emotions, I would have killed myself.",Fortune Telling,4
1225,"I’m in a panic, she’s due back in a month and I just can’t face her, I’m scared I would make her life miserable if she was to come back to me",Emotional Reasoning,6
1226,Unfortunately for many years now this is not the case. I tend to believe that this was due to a very hard break up that I had when I was around 21.,Overgeneralizing,2
1227,I’m scared I can’t control it anymore.,Emotional Reasoning,6
1228,"Something in my head, not a voice but a feeling, told me she was going to dig her nails into my back and rip out my heart.",Fortune Telling,4
1229,"I’m also convinced that other people can read my thoughts, maybe not everyone, but definitely most people.",Mind Reading,5
1230,I fully understand that i wish to heal and i also respect her abilities however I feel again she is in decision making to terminate me.  As last week it was apparent she needed affirmation from me that the anger work was useful.,Mind Reading,5
1231,Basically im very paranoid and at first it seemed to all be related to social anxiety like i would convince myself they all hated me and would delete all my social media and hate them for supposedly hating me (for something as silly as not answering a text) but i got in trouble so im fairly isolated now and only have myself to talk to.,Mind Reading,5
1232,I tend to do things to manipulate to make them think of me as a good person who cares about them so they would come in handy when I need them,Fortune Telling,4
1233,"By all accounts, I should be highly successful.",Should Statements,7
1234,"It’s like an obsession, and I think that’s it’s because I’ve always had a hard time classifying my emotions, so I try to classify my thoughts instead.",Disqualifying the Positive,9
1235,The anxiety I get from it has changed me completely and I can’t do anything I used to.,Overgeneralizing,2
1236,He cheated before and I have had a hard time trusting him since that but before that I was accusing him so I feel like I pushed him to it.,Overgeneralizing,2
1237,"They want me to give myself time to think about my relationship, where really I know they just want me to end the relationship.",Mind Reading,5
1238,I felt guilty because I felt happiness when somebody died in a movie I was watching.,Personalizing,8
1239,"I don’t see him anymore, and I still feel guilty. I feel as though I could have stayed there longer, could have been less prideful and tried harder.",Personalizing,8
1240,"I find it difficult to articulate my thoughts alone, but to explain it to her seems almost impossible.",Overgeneralizing,2
1241,I’m in my 3rd trimester and my mom seems to be a devil!,Labeling,3
1242,"I stay even when I know I shouldn’t. I feel like I am not capable of doing anything, I feel like the biggest waste.",Should Statements,7
1243,It makes me feel afraid to go to sleep and I usually end up being awake until the sun rises.,Emotional Reasoning,6
1244,"However, I know I also have to think rationally and evaluate the changes that have been made in the past 18 months.",Should Statements,7
1245,He’s a danger to us and a terrible father.,Labeling,3
1246,For a while I thought they were messengers sent to me and I was terrified of them but couldn’t get away.,Disqualifying the Positive,9
1247,"then, some days ago I found that she had sexual relationships with two other guys, and now these revelations are killing me. I was perfectly happy man but now I think I am the most desperate person in the world. I am like dying out of grief and I cannot handle it.",All-or-Nothing Thinking,1
1248,It was the worse in middle school when her friend moved and nobody at all liked her.,Overgeneralizing,2
1249,"At times, I seem to incorrectly read people’s emotions, whether spoken or not, and I tend to get angry and frustrated when there is no need to be.",Mind Reading,5
1250,"I’m sure this will sound absurd, but this is my situation. I do bring it up very often as I’m skeptical about how truthful he really is.",Mind Reading,5
1251,"My girlfriend’s father was very abusive and loveless, and her mother had to escape with the kids one night when she was 13.",Labeling,3
1252,"They didn’t want me to tell him because they thought he would think that was weird, but I had to because I knew it would get in the way of us trying anal sex which I had told him I would like to try with him.",Fortune Telling,4
1253,"Sometimes I think she exaggerates health issues to be the center of attention.   I know in the mind my mom will never really approve of me or respect me or be there for me, but my heart wont accept it.",Mind Reading,5
1254,My breathing speeds up and i can’t stop thinking about it until i do it.,Disqualifying the Positive,9
1255,So these past couple months my Significant other seems to get angrier and angrier at things that are so simple.,Mind Reading,5
1256,I want to get help but I’m too scared to talk to anyone about it because I feel like my problems aren’t important and they have better things to do than listen to me go on.,Catastrophizing,10
1257,I feel guilty because there are no other siblings or family… just me. This situation feels like the rest of my life,Personalizing,8
1258,I am terrified of life.,Catastrophizing,10
1259,I did not tell them because I was just seeing him and not asking them to engage in any form of relationship because I knew they would not want to.,Fortune Telling,4
1260,"i am either always depressed, irritable or completely “done” with the world and feel as if no one could do anything to change my view or the world itself.",Disqualifying the Positive,9
1261,I felt like such a loser cuz everyone was communicating and didn’t even notice I was there.,Labeling,3
1262,"I know it’s absurd, but I can’t shake this belief.",Should Statements,7
1263,It’s really bothering me right now because school is getting a lot harder and I feel like i can’t keep up.,Emotional Reasoning,6
1264,My entire way of thinking has changed.   I think my head will explode like a bomb.,Overgeneralizing,2
1265,"Now, my anxiety is getting worse. I am starting to display what I would call “social anxiety” symptoms. I don’t leave the house unless I have to for work, I avoid going to parties, I avoid meeting friends for lunch or dinner, I even show up late for family Christmas parties.",Catastrophizing,10
1266,Lately I’ve been having mood swings where I’ll get really hyped and confident and encouraging and then I’ll get angry and whenever my boyfriend says to calm down it’s like a switch and it’s as if I never felt anything to begin with,All-or-Nothing Thinking,1
1267,"Read a lot about psychopaths and psychotic people on the internet and with the tiredness, not having much news I began to think I was a psychopath myself, that I am a very bad person and began to have flashes of me doing bad things to people and i got very scared so i didn’t sleep well again for weeks.",Labeling,3
1268,"Since then there hasn’t been a single day where I haven’t thought about that night and often worry about it happening again, it causes me to get very upset if people start shouting at me or anything like that because I get scared that they’ll hit me, even if it’s someone close to me and I know really that they won’t hurt me.",Overgeneralizing,2
1269,He has a younger sister who is very attention seeking and comes and lives with us for a month every year.,Labeling,3
1270,"My mom has bipolar disorder and depression, she will spend a couple months never leaving her room and watching tv.",Overgeneralizing,2
1271,As a result of which for anything bad that happens in my life I blame him.,Personalizing,8
1272,"That is one where I now feel no purpose or have any desire to do anything with life and feel it not too far away where it becomes unmanageable and I will commit suicide, albeit not wanting it.",Emotional Reasoning,6
1273,"Although I know it’s wrong to self-diagnose, I self-diagnosed myself with dysthymia just in February because I started thinking about killing myself, although I never actualized my thoughts (because I know it’s wrong), when before, starting when I was around 8, I just thought of about how life for me and for everyone else around me might be better off without me being born – because I noticed the favoritism of my parents toward me over my sister.",Overgeneralizing,2
1274,Doing LSD is pretty much the only good choice I’ve ever made.,Overgeneralizing,2
1275,"But I don’t know how to tell my parents to just leave it alone, let us grow apart, we have nothing in common and just shouldn’t be talking. If he was in REAL treatment maybe things would be different but he doesn’t want things to change.",Should Statements,7
1276,"Half of my mind tells me to go out and kill someone, while the other half says that it’s wrong and I shouldn’t. I’ve gotten to the point where I have cut myself so the feeling would go away.",Should Statements,7
1277,"But regularly I feel depressed, I comfort eat, I feel that I am being a terrible father, I feel that I am not supporting my family correctly and feel extremely guilty for having these feelings.",Emotional Reasoning,6
1278,"i have every thing that makes me hate myself, i go to the gym but still hate myself , i aslo tried to treat my acne but its not helping. this really affecting my self-esteem and my social life i dont feel confident at all and i hate myself",Personalizing,8
1279,I don’t know why these thoughts come up and they bother me a lot. I’m very scared of someone not caring enough about me.,Emotional Reasoning,6
1280,"I am concerned that if I can’t control my impulses to something as innocent as a kitten, what can happen in the future towards my daughter?",Fortune Telling,4
1281,"I do not believe that hate, resentment, or just a lack of caring are the appropriate feelings to have when someone is having a problem, and yet, I feel these types of feelings.",Should Statements,7
1282,"There is nothing about me that stands out as an artist, and I feel like I just don’t offer anyone anything.",Overgeneralizing,2
1283,I’m afraid that one day I’ll be sent to a mental institution if I end up doing something horrible.,Fortune Telling,4
1284,"For the past 4 years, I’ve been experiencing memories of bad stuff that’s happened as a kid. I have been bullied at school and have issues communicating with people and family. I don’t have to many friends and have a hard time talking with people. I get extremely irritated around a lot of people.",Disqualifying the Positive,9
1285,Am I making a scapegoat of their therapist? It just feels like she behaved recklessly and at the expense of my father.,Personalizing,8
1286,It really felt as if an animal had surfaced within me.,Emotional Reasoning,6
1287,"Stigmas are killing me and my mother, who also suffers mentally/physically, makes it hard for me to leave, connect with others, and has an issue with me and my sister growing up and being independent. ",Overgeneralizing,2
1288,"I want him to be happy, and if that means breaking up with me that’s fine, but I don’t think that breaking up will make him any happier, because he cries at the thought of it and hasn’t made any motion to dump me yet..",Fortune Telling,4
1289,I don’t think this will ever stop.  I deeply regret it but I don’t want anyone to think that they could get away with tormenting me.,Fortune Telling,4
1290,"I felt invalid and unloved, and one day, I came to realize this was true.   I thought it was all my fault, even if I’d been told it wasn’t. ",Labeling,3
1291,"Lately, it has turned into OCD characterized by intrusive thoughts of guilt and shame over many things. I have often wondered if there is a memory that I have long-suppressed from my childhood that has been a root cause for my issues.",Personalizing,8
1292,"I also have substance abuse problems, Im irrational and impulsive, and making common decisions is difficult.  The thought of seeking actual help, I know what I feel isn’t normal, but I fear what will become of me or my family if I go and completely honest.",Labeling,3
1293,I don’t think anyone in the world would hate or judge me more than I do myself and deservedly so.,Personalizing,8
1294,"Im afraid to talk to people and when I’m around people I feel like my soul leaves my body and I start having an “episode”, where I freak out and feel like I’m literally going to die.  I’m so scared all the time because I dwell on the thought of “am I actually alive or not?”.",Fortune Telling,4
1295,"I lost everything in 2008 including the ability to control my actions, for years my emotions ran everything.",Overgeneralizing,2
1296,In the last appointment my GP asked me if I was suicidal and I went off on her pointing out that she was only asking to cover her own ass and that I knew if I said yes it would mean her calling an ehs crew to come and restrain me (the one thing that I’d told her earlier would make me violent).,Mind Reading,5
1297,"I knew something was shady so I confronted him and told him not to lie, but he proceeded to and was going to fake the whole thing FOR A PICTURE.",Mind Reading,5
1298,I have a good job that I (kinda) enjoy but recently I feel like everyone that I work with is waiting for me to mess up. I don’t have much confidence in myself as it and always feel like everyone is judging me.,Mind Reading,5
1299,I am crippled by loneliness. Mainly because my behaviors are antisocial and disgusting.,Personalizing,8
1300,"I cant talk right, not even when Im alone.",Should Statements,7
1301,"And I’m disgusted by this because I want to finish stuff, but then I don’t.",Personalizing,8
1302,"This is my first shot in corporate world and since I am a survivor of repeated child sexual abuse, I have very low self esteem, trust and sharing issues I already am not sure if I will be able to survive in this cut throat world.  Everything haunts me and I hate myself and when a guy even for wrong reasons said he likes me, I melted.",Fortune Telling,4
1303,Since I lived with my mother alone I have had loops of everything she used to tell me I was growing up- all leading up to “no one will love me if I don’t try really really hard to maintain their love”.,Fortune Telling,4
1304,I deal with my emotions in front of other people and affect them instead of dealing with my emotions in private.,Personalizing,8
1305,"Every time she does something that irritates me i get really angry and start to breath heavy and have the need to break things, after that i start to cry and whisper to myself “I hate her, i hate her.”",Catastrophizing,10
1306,"I am constantly becoming angry over very little things and sometimes I notice that I am angry for no reason at all. It is usually a very intense anger and I feel as it controls me and I mostly cannot control it. It is like every little thing sets me off into a rage and I make very poor decisions such as punching something, breaking something or throwing something.",Catastrophizing,10
1307,"They are recovering from anorexia (very underweight) and body dysmorphic disorder, as well as depression and hints of bipolar disorder but are acting selfish, cruel, irrational, entitled.",Labeling,3
1308,"Now that I’m writing this all down, it’s making me sound like some kind of deformed, basement-dwelling freak.",Labeling,3
1309,"I could not tell anyone for fear of his reaction, I am aware of what I see, what I feel .. but there are times when I confuse hallucinations with the real world, these “imaginary friends” tell me to do and say things such as attacking another person, insult, hurt me physically it.",Mind Reading,5
1310,I’m afraid people can hear what i’m thinking and they’re all just trying to hide it from me.,Mind Reading,5
1311,But i always had the same problem: at some point i was becoming a person no one paid interest to or even tried to ignore me.  The second problem i face–i cant concentrate at all.,Overgeneralizing,2
1312,"A good example: if anything makes me angry–trivial or truly important, I might put on a wild, embarrassing, very inappropriate, and very unhealthy display of rage.",Catastrophizing,10
1313,Also I’m stressed out with this but also with my mom who is a smoker and heavy soda drinker my father is doing some time and recovering from drug addiction. A lot of family is like this. I want my parents to be around awhile so I can afford to give them the life they never had or never gave my younger brother and me. My relationship with my brother and mother isn’t good either. I don’t have any friends or girlfriend.,Disqualifying the Positive,9
1314,"However, the thought keeps bothering me that I am just seeking attention.",Personalizing,8
1315,"I cannot seem to get out of bed, the very thought of facing the world every day makes me cry and debate my life.  I hate myself. I cannot function in any social situation and now I can’t even seem to do any simple task anymore.",Catastrophizing,10
1316,I feel like I am cursed for life.,Fortune Telling,4
1317,"It’s been so scary to go to sleep at night, because I’ve been afraid of not waking up in the morning.   I’m afraid (not meaning to be graphic) but I’m afraid that I’m going to be possessed and hurt myself in my sleep.  I’m absolutely terrified, I’m afraid that I’m going to die or develop some kind of psychosis. ",Emotional Reasoning,6
1318,"I know this is completely inappropriate, and I want to get passed it.",Should Statements,7
1319,"To make matters worse, I’ve completely lost the ability to empathize with others, or rather, I can’t remember the last time I’ve felt empathy towards anyone.  I noticed my issue upon a death within the family, throughout the entire process I didn’t feel anything, at points I even tried to force myself to feel as I thought I would be a horrible for not doing so.",Overgeneralizing,2
1320,I feel always that people are watching me.,Mind Reading,5
1321,"First, I’ve always had a ton of stress, depression, and anxiety from being raised by dysfunctional parents (which persists), along with other things.",Labeling,3
1322,I just feel like I have no control over anything… it’s like I’m just always supposed to be on… I never have time for myself… I’m always either studying or working or listening to my mother’s problems with her ex-husband.,Emotional Reasoning,6
1323,"Thats not to say that i’m a perfectionist , the work i’m in now is far from impressive, nor is any other aspect in my life, in short to say that i’m a failure is a understatement.despite all this, i still feel that i’m the same person, i should be better , i should be in a better work position , i should be more outing , but i’m none of these and fear I never will be; simply because all of the things i’ve done so far are no good if i’m just going to remain in the same position.",Should Statements,7
1324,I was diagnosed with venous leak by a urologist. I had a complete nervous breakdown. I spent night after night hyper-ventilating and wishing for death as I felt totally worthless and very suicidal. It was all I thought about and it ruined me. I dropped out of university as I couldn’t focus on my work with my misery and obsessive intrusive thoughts.,Catastrophizing,10
1325,"I’m 17 now and should be off to university next year, but I’m so scared I don’t know if I should. I have a history of depression, really bad self-esteem, and I know I show many symptoms of OCD and anxiety, specifically GAD. The thought of going to university at this point terrifies me as I am worrying that all of my problems will get worse and worse to the point that I can’t cope anymore.",Should Statements,7
1326,"I’m an 8th grade boy, I hope I won’t be judged differently or ignored because I am under 18.",Mind Reading,5
1327,"My downfall started when I was 16, and was coerced into having sex with a 20-year-old guy I wasn’t even into. From there I had several more casual encounters. I acted like I wanted it, and was proud of “being a slut”, but to be honest I died a little on the inside every time.",Labeling,3
1328,I’m 30 and have never experienced the feeling of being embarrassed or shame.,Overgeneralizing,2
1329,"I’d like to seek treatment for previously diagnosed mental illness along with ones I suspect I may have, but I feel like I won’t be able to be successful with my parents constantly making me feel like my illnesses are made-up or just an excuse.",Fortune Telling,4
1330,"She is sad because her knee hurts and she is frightened to go for a surgery although she has so much trouble walking, nobody helps around the house, my grandma visits her everyday and drives her crazy, dad is so messy and unhelpful, and many other things that she calls me everyday to nag about.",Overgeneralizing,2
1331,"I always feel like I am fat. I always think of worst case scenarios, for example, my husband will leave to go to the store and I’ll worry that he’ll get in car accident. I worry a lot that my children will hate me when their older. When ever someone asks me for advice I am always negative. I get angry over nothing. I hate it. Anything will set me off such as just having to repeat myself will make me extremely upset. I have a hard time falling asleep at night because I am afraid someone will brake in and kill me while I’m sleeping. I will think about a situation over and over in my head and I have to tell my self constantly to stop thinking about it because I get so upset mostly thinking that I looked like an idiot.",Fortune Telling,4
1332,"I was terrified of what people thought about me, and I still am. And because of that I avoid people, even my classmates.",Mind Reading,5
1333,"Ok, someting very strange I have noticed is that I’m unable to visualize my therpaists face (no problem recognizing her) it is truly bizare as I have no problem with anyone else I know, I have an excellent memory and very good 3D visio-spacial, I’m very good at visualizing situations I’ve been in and can visualize people in meetings from months ago even having only seen them once. I’ve sat looking at this lady for over 15 hours now but draw a complete blank when attempting to visualise what she looks like (unless I’m in the session of course!) — There is definitely some strange stuff going on subconsciously I think.",Catastrophizing,10
1334,"A month later, he brought another woman into my home and proceeded to be sexual with her while another of his friends was visiting. There is something wrong with me that this would go on.  I have no one I can trust. I tried to be a good woman.This has me so confused and I think I am crazy, now.",Personalizing,8
1335,"I’m so confused with my own mentality, one side of me loves to be alone and would avoid meeting and maintaining relationships with friends or putting any effort into these friendships at all. I guess this is because I don’t like to compromise on my daily routine or in life …so selfishly, if I meet with someone it will be because I want to. Which is rare.",Labeling,3
1336,"I find that even on the Celexa, I am very moody and quick to anger. I find that little things just send me into a negative mood and for the rest of the day, I am just grumpy all the time.Some days are good, but I find the most days I am grumpy and no fun to be around.When I take a medical marijuana pill, I feel like a veil is removed and the person I should be is present (not stoned, just enough to remove the pain). I am nice, I am not as stressed, I am able to show the emotions I wish I could every day. I just feel like the person I should always be. When not on my medical marijuana, I again am anxious, quick to anger, grumpy, the idea of going to the store is a chore, everything becomes a chore. I really want to know why I cannot be the man who can show emotion to his family and not be such a downer. I really want to find out what I can do to get past my issues and be the man my family deserves.",Should Statements,7
1337,"Is this “normal” or do I have a dysfunction? Sometimes, over nothing, after working myself up into almost unnoticeable stress — even to me — I lose it.",All-or-Nothing Thinking,1
